{
  "contract_id": "AIGC-PRODUCTION-CONNECTOR-SECRET-BROKER-001",
  "contract_version": "1.0.0",
  "status": "IMPLEMENTED_INTERNAL_PENDING_STAGING_EVIDENCE",
  "environment_decision_path": "config/production_environment_decision.json",
  "secret_manager": {
    "provider": "google_secret_manager",
    "project_id": null,
    "reference_scheme": "gcp_secret",
    "replication_strategy": "user_managed_canada",
    "approved_locations": [
      "northamerica-northeast2",
      "northamerica-northeast1"
    ],
    "workload_identity_required": true,
    "raw_values_in_repository": false,
    "raw_values_in_logs": false,
    "raw_values_in_receipts": false,
    "access_audit_required": true,
    "rotation_required": true
  },
  "connector_policy": {
    "official_api_required": true,
    "scraping_allowed": false,
    "credential_automation_allowed": false,
    "destination_allowlist_required": true,
    "idempotency_required": true,
    "dry_run_required_before_write": true,
    "human_approval_for_consequential_actions": true,
    "approval_ttl_seconds": 900,
    "payload_persistence": "DIGEST_ONLY",
    "production_default": "DENY"
  },
  "connectors": [
    {
      "connector_id": "github",
      "platform": "GitHub",
      "official_api": true,
      "enabled": false,
      "authentication": "github_app",
      "secret_reference": "gcp_secret://TBD_PROJECT/aigc-github-app/latest",
      "destination_allowlist": [],
      "operations": [
        {
          "operation_id": "read_repository",
          "mode": "read",
          "consequence": "read_only",
          "approval_scope": null
        },
        {
          "operation_id": "create_issue",
          "mode": "write",
          "consequence": "external_write",
          "approval_scope": "CONNECTOR_GITHUB_CREATE_ISSUE"
        },
        {
          "operation_id": "comment_pull_request",
          "mode": "write",
          "consequence": "external_write",
          "approval_scope": "CONNECTOR_GITHUB_COMMENT_PR"
        }
      ],
      "staging_evidence_status": "NOT_STARTED",
      "terms_review_status": "REQUIRED"
    },
    {
      "connector_id": "google_drive",
      "platform": "Google Drive",
      "official_api": true,
      "enabled": false,
      "authentication": "oauth2",
      "secret_reference": "gcp_secret://TBD_PROJECT/aigc-google-drive-oauth/latest",
      "destination_allowlist": [],
      "operations": [
        {
          "operation_id": "search_files",
          "mode": "read",
          "consequence": "read_only",
          "approval_scope": null
        },
        {
          "operation_id": "create_managed_file",
          "mode": "write",
          "consequence": "external_write",
          "approval_scope": "CONNECTOR_DRIVE_CREATE_FILE"
        }
      ],
      "staging_evidence_status": "NOT_STARTED",
      "terms_review_status": "REQUIRED"
    },
    {
      "connector_id": "gmail",
      "platform": "Gmail",
      "official_api": true,
      "enabled": false,
      "authentication": "oauth2",
      "secret_reference": "gcp_secret://TBD_PROJECT/aigc-gmail-oauth/latest",
      "destination_allowlist": [],
      "operations": [
        {
          "operation_id": "search_messages",
          "mode": "read",
          "consequence": "read_only",
          "approval_scope": null
        },
        {
          "operation_id": "create_draft",
          "mode": "write",
          "consequence": "draft_only",
          "approval_scope": "CONNECTOR_GMAIL_CREATE_DRAFT"
        },
        {
          "operation_id": "send_message",
          "mode": "write",
          "consequence": "external_write",
          "approval_scope": "CONNECTOR_GMAIL_SEND"
        }
      ],
      "staging_evidence_status": "NOT_STARTED",
      "terms_review_status": "REQUIRED"
    }
  ],
  "operational_evidence": {
    "secret_manager_project_configured": false,
    "workload_identity_observed": false,
    "secret_access_audit_observed": false,
    "rotation_observed": false,
    "github_staging_receipt": false,
    "google_drive_staging_receipt": false,
    "gmail_staging_receipt": false,
    "duplicate_prevention_passed": false,
    "revocation_passed": false,
    "redaction_review_passed": false
  },
  "authority": {
    "internal_framework_implementation_authorized": true,
    "offline_adapter_testing_authorized": true,
    "secret_access_authorized": false,
    "oauth_authorization_authorized": false,
    "staging_read_authorized": false,
    "staging_write_authorized": false,
    "production_connector_activation_authorized": false,
    "production_external_action_authorized": false
  },
  "external_action_performed": false
}
